What 's going on ?	I 'm coming over to your side , that 's what . And I have a feeling I 'm making a big mistake .
I 'm coming over to your side , that 's what . And I have a feeling I 'm making a big mistake .	And when do you betray us again ?
Look , I stand to lose everything by this .	We have no use for your kind .
We have no use for your kind .	This is no time to be choosy , honey . What do you say we debate this later ? There 's still a chance I can get you out of here .
Chewie 's right . We must try to save Han .	There 's not much chance , but the bounty hunter 's ship is on the East Landing Platform .
Very noble . Not smart , but noble .	You 've probably never done an honorable thing in your life .
You 've probably never done an honorable thing in your life .	Sure I did . once . It turned out lousy .
Sure I did . once . It turned out lousy .	What chance have we got in here ? What are we going to do when they cut .
You 'd better know what you 're doing , or this is going to get very messy .	Don't worry about a thing . I 'll get us going .
We 've got to find Luke .	His fate is sealed . You 'll be lucky to get out yourself . All systems are on alert . everything 's locked .
What 'd you say ?	I didn't say anything ?
I knew that set-up was too good to last . I 'm going to miss it .	Luke !
Luke !	What ?
What ?	Luke needs help . We must go back .
No argument , just do it . That 's a command !	Wait a minute . We 're not going back there .
Someone 's falling .	It 's Luke . Get under him . Slow down . Easy Chewie . Line up your tracking system . Lando , open the hatch .
The deflector shields are gone .	Are the coordinates set ?
I 'm sure my men fixed it . We 've got nothing to worry about .	That sounds familiar .
Nothing more can be done tonight . The shield doors must be closed . I can't wait any longer . I 'm sorry .	I understand .
The speeders should be ready in the morning . They 'll make the search easier .	Is there any chance of them surviving out there ?
Is there any chance of them surviving out there ?	Slim , but yes , there 's a chance . They have a shelter . It 's not much , but .
Have they analyzed the one that was killed ?	Not yet . They 're working on it now .
We 've picked up something outside the base in zone one , moving East .	What is it ?
Two transports at a time is awfully risky .	We have no choice . Send them up . and start clearing everyone out .
You rest now .	So much has happened during the period of your indisposition , sir .
So much has happened during the period of your indisposition , sir .	I 'll be back later .
You don't have to do this to impress me .	If I might remind you , sir , the probability of successfully navi- gating through an asteroid field is approximately 365,000 to one . a graceful surrender might not be .
Closer ?!	Closer ?!
A tremor !	Sir , it 's very possible this asteroid is not stable .
What ?	Oh my , no !
Sir , we 've lost the rear deflector shield . One more direct hit on the back quarter and we 're done for .	Well , what now ?
Rather touchy , aren't they .	I thought you knew this person .
Artoo , you did it ! I never doubted you for a second .	Let 's go .
The Bacta are growing well . The scars should be gone in a day or so . Does it still hurt ?	I 'm fine . Really . Leia . when I was out there and it looked pretty bad . well , it made me think about things .
I 'm fine . Really . Leia . when I was out there and it looked pretty bad . well , it made me think about things .	Me too . I was afraid .
Leia . What would you think if I went away for a while ?	What did you say ?!
Where are you going ?	I have this . feeling . I 'm not sure , really .
I have this . feeling . I 'm not sure , really .	That 's just great . Why doesn't everyone just take off ?
That 's just great . Why doesn't everyone just take off ?	What are you talking about ?
What are you talking about ?	First Han , now you . When am I going to learn not to count on anyone but myself ? .
First Han , now you . When am I going to learn not to count on anyone but myself ? .	Han 's leaving ?
Calm down , will ya ? Tell me about Han .	He wants to pay off that criminal he 's in hock to .
He wants to pay off that criminal he 's in hock to .	Jabba the Hutt ?
Jabba the Hutt ?	I could get more loyalty if I went down the hall and recruited some of those snow creatures .
I could get more loyalty if I went down the hall and recruited some of those snow creatures .	Snow creatures . they 're here ?!
Leia !	Luke , no ! It 's a trap .
Lando , is he alright ? . Lando ? Are you there ? How 's Luke ?	He 'll survive .
This hyperdrive had better work .	I 've never seen it fail .
Ready are you ? What know you of ready ? I have trained Jedi for 800 years . My own counsel I 'll keep on who is to be trained .	Why not me ?
Why not me ?	To become a Jedi takes the deepest commitment , the most serious mind .
I have followed my feelings .	You are reckless !
I will not fail you . I 'm not afraid .	You will be , my young one . Heh . You will be .
It would be in seven pieces , were you a Jedi .	I thought I was in good shape .
I thought I was in good shape .	Yes , but by what standard , ask I ? Forget your old measures . Unlearn , heh , unlearn .
Master , moving rocks is one thing , but this is a little different .	No ! No different ! The differences are in your mind . Throw them out ! No longer of use are they to you .
No ! No different ! The differences are in your mind . Throw them out ! No longer of use are they to you .	Okay . I 'll give it a try .
Okay . I 'll give it a try .	No . Try not . Do , do . Or do not . There is no try .
I can't . It 's too big .	Size has no meaning . It matters not . Look at me . Judge me by my size do you ?
I don't believe it .	That is why you fail .
Concentration . Heh ? Concentration .	I thought those seekers were set for stun !
I thought those seekers were set for stun !	That they are .
That they are .	They 're a lot stronger than I 'm used to .
They 're a lot stronger than I 'm used to .	That would matter not were The Force flowing through you . Higher you 'd jump ! Faster you 'd move ! Open yourself to The Force you must .
No , no . This will not do . Anger is what you feel .	But I feel The Force flowing !
But I feel The Force flowing !	Anger , fear , aggression ! The dark side of The Force are they . Easily they flow . quick to join you in a fight . Beware , beware , beware of them . A heavy price is paid for the power they bring .
Price ? What do you mean ?	The dark side beckons . But if once start down the dark path , forever will it dominate your destiny . Consume you it will . as it did wan 's apprentice .
The dark side beckons . But if once start down the dark path , forever will it dominate your destiny . Consume you it will . as it did wan 's apprentice .	Lord Vader . Is the dark side stronger ?
Lord Vader . Is the dark side stronger ?	No , no . Easier , quicker , more seductive .
No , no . Easier , quicker , more seductive .	But how am I to know the good side from the dark ?
But how am I to know the good side from the dark ?	You will know . When you are at peace . calm . passive . A Jedi uses The Force for knowledge and defense . Never for attack .
You will know . When you are at peace . calm . passive . A Jedi uses The Force for knowledge and defense . Never for attack .	But tell me why .
But tell me why .	No ! Nothing more will I tell you now . Clear your mind of questions . Quiet now be . at peace .
Four this time ! The Force you feel .	Yes . I also feel danger . death . Something 's not right .
I feel cold .	This tree is strong with the dark side of The Force . A servant of evil it is . Into it you must go .
This tree is strong with the dark side of The Force . A servant of evil it is . Into it you must go .	What 's in there ?
What 's in there ?	Only what you take with you .
Ben ? Ben ?	Free your mind and return he will .
Free your mind and return he will .	My mind fills with so many images .
My mind fills with so many images .	Control , control you must learn of what you see . Not easy , not fast .
Control , control you must learn of what you see . Not easy , not fast .	I see a city in the clouds .
I see a city in the clouds .	Bespin . I see it too . Friends you have there , heh ? Concentrate and see them you will .
Bespin . I see it too . Friends you have there , heh ? Concentrate and see them you will .	I see them ! . They 're in pain . they 're suffering .
I see them ! . They 're in pain . they 're suffering .	It is the future you see .
Will they die ?	Difficult to see . Always in motion is the future . Back away , little machine !
They 're my friends .	Foreknowledge is helpful , but painful sometimes and dangerous too . You have far to go in your training .
Yes , yes . To Obi-wan you listen young one . The tree . Remember your failure at the tree ! Heh ?	I 've learned so much since then . And I 'll return to finish . I promise that , master .
And sacrifice Han and Leia ?	If it must be . Yes .
The fear does not reach you . You have learned more than I anticipated .	You 'll find I 'm full of surprises .
You 'll find I 'm full of surprises .	And I too .
Your future lies with us , Skywalker . Now you will embrace the dark side . Obi-wan knew this to be true .	No !
No !	There is much Obi-wan did not tell you . Come , The Emperor will complete your training .
There is much Obi-wan did not tell you . Come , The Emperor will complete your training .	I 'll die first .
I 'll die first .	That won't be necessary .
All too easy . Perhaps you are not as strong as The Emperor thought .	Time will tell .
The Force runs strong in the Skywalker line . You will achieve great power . Come , join with me ! Together we will be the most powerful . even stronger than The Emperor .	No ! . Never .
There is no escape . You must join me or die . Don't make me destroy you here . The Emperor is strong with The Force . But if you join me , together we could overthrow Him . Do not resist . It is our destiny !	Never .
The Hoth System ?	Yes , Sir . we have visuals . the System is supposed to be devoid of human forms .
Yes , My Lord .	Make ready to land General Veers ' assault troops on the surface . Then deploy the fleet so that nothing can get off that system . You 're in command now , Admiral Piett .
Seventeen ships destroyed , we don't know how many got away .	Anything on the Millennium Falcon ?
Anything on the Millennium Falcon ?	It won't get through the blockade .
It won't get through the blockade .	I want that ship .
Admiral , we 're in position . All fighters accounted for .	Proceed with the countdown . All groups assume attack coordinates .
All craft , prepare to jump to hyperspace on my mark .	All right . Stand by .
We saw it . All craft prepare to retreat .	You won't get another chance at this , Admiral .
You won't get another chance at this , Admiral .	We have no choice , General Calrissian . Our cruisers can't repel firepower of that magnitude .
We have no choice , General Calrissian . Our cruisers can't repel firepower of that magnitude .	Han will have that shield down . We 've got to give him more time .
At that close range , we won't last long against those Star Destroyers .	We 'll last longer then we will against that Death Star . and we might just take a few of them with us .
The shield is down ! Commence attack on theDeath Star 's main reactor .	We 're on our way . Red Group , Gold Group , all fighters follow me . Told you they 'd do it !
I can't do it , Artoo . I can't go on alone .	Yoda will always be with you .
You told me Vader betrayed and murdered my father .	You father was seduced by the dark side of the Force . He ceased to be Anakin Skywalker and became Darth Vader . When that happened , the good man who was your father was destroyed . So what I have told you was true . from a certain point of view .
There 's still good in him .	I also thought he could be turned back to the good side . It couldn't be done . He is more machine now than man . Twisted and evil .
I also thought he could be turned back to the good side . It couldn't be done . He is more machine now than man . Twisted and evil .	I can't do it , Ben .
I can't do it , Ben .	You cannot escape your destiny .
You cannot escape your destiny .	I tried to stop him once . I couldn't do it .
I tried to stop him once . I couldn't do it .	Vader humbled you when first you met him , Luke . but that experience was part of your training . It taught you , among other things , the value of patience . Had you not been so impatient to defeat Vader then , you could have finished your training here with Yoda . You would have been prepared .
Vader humbled you when first you met him , Luke . but that experience was part of your training . It taught you , among other things , the value of patience . Had you not been so impatient to defeat Vader then , you could have finished your training here with Yoda . You would have been prepared .	But I had to help my friends .
To be a Jedi , Luke , you must confront and then go beyond the dark side - the side your father couldn't get past . Impatience is the easiest door - for you , like your father . Only , your father was seduced by what he found on the other side of the door , and you have held firm . You 're no longer so reckless now , Luke . You are strong and patient . And now , you must face Darth Vader again !	I can't kill my own father .
I can't kill my own father .	Then the Emperor has already won . You were our only hope .
Then the Emperor has already won . You were our only hope .	Yoda spoke of another .
Yoda spoke of another .	The other he spoke of is your twin sister .
The other he spoke of is your twin sister .	But I have no sister .
But I have no sister .	Hmm . To protect you both from the Emperor , you were hidden from your father when you were born . The Emperor knew , as I did , if Anakin were to have any offspring , they would be a threat to him . That is the reason why your sister remains safely anonymous .
Hmm . To protect you both from the Emperor , you were hidden from your father when you were born . The Emperor knew , as I did , if Anakin were to have any offspring , they would be a threat to him . That is the reason why your sister remains safely anonymous .	Leia ! Leia 's my sister .
Leia ! Leia 's my sister .	Your insight serves you well . Bury your feelings deep down , Luke . They do you credit . But they could be made to serve the Emperor .
But you can't let her get involved now , Ben . Vader will destroy her .	She hasn't been trained in the ways of the Jedi the way you have , Luke . but the Force is strong with her , as it is with all of your family . There is no avoiding the battle . You must face and destroy Vader !
Shhh . You have hibernation sickness .	I can't see .
I can't see .	Your eyesight will return in time .
Your eyesight will return in time .	Where am I ?
Where am I ?	Jabba 's palace .
Jabba 's palace .	Who are you ?
The Death Star will be completed on schedule .	You have done well , Lord Vader . And now I sense you wish to continue your search for young Skywalker .
You have done well , Lord Vader . And now I sense you wish to continue your search for young Skywalker .	Yes , my Master .
Yes , my Master .	Patience , my friend . In time he will seek you out . And when he does , you must bring him before me . He has grown strong . Only together can we turn him to the dark side of the Force .
Patience , my friend . In time he will seek you out . And when he does , you must bring him before me . He has grown strong . Only together can we turn him to the dark side of the Force .	As you wish .
As you wish .	Everything is proceeding as I have foreseen .
What is thy bidding , my Master ?	Send the fleet to the far side of Endor . There it will stay until called for .
Send the fleet to the far side of Endor . There it will stay until called for .	What of the reports of the Rebel fleet massing near Sullust ?
What of the reports of the Rebel fleet massing near Sullust ?	It is of no concern . Soon the Rebellion will be crushed and young Skywalker will be one of us ! Your work here is finished , my friend . Go out to the command ship and await my orders .
It is of no concern . Soon the Rebellion will be crushed and young Skywalker will be one of us ! Your work here is finished , my friend . Go out to the command ship and await my orders .	Yes , my Master .
I told you to remain on the command ship .	A small Rebel force has penetrated the shield and landed on Endor .
I have felt him , my Master .	Strange , that I have not . I wonder if your feelings on this matter are clear , Lord Vader .
They are clear , my Master .	Then you must go to the Sanctuary Moon and wait for them .
Oh , no , my young Jedi . You will find that it is you who are mistaken . about a great many things .	His lightsaber .
Han !	Luke !
Luke !	Are you all right ?
Are you all right ?	Fine . Together again , huh ?
Fine . Together again , huh ?	Wouldn't miss it .
Wouldn't miss it .	How are we doing ?
How are we doing ?	The same as always .
The same as always .	That bad , huh ? Where 's Leia ?
I think my eyes are getting better . Instead of a big dark blur , I see a big light blur .	There 's nothing to see . I used to live here , you know .
There 's nothing to see . I used to live here , you know .	You 're gonna die here , you know . Convenient .
You 're gonna die here , you know . Convenient .	Just stick close to Chewie and Lando . I 've taken care of everything .
Just stick close to Chewie and Lando . I 've taken care of everything .	Oh . great !
Why don't you leave that crate and come with us ?	I have a promise I have to keep first . to an old friend .
Luke .	Hi , Han . Chewie .
You got her warmed ?	Yeah , she 's comin ' up .
Right . Chewie , let 's see what this piece of junk can do . Ready , everybody ?	All set .
Vader 's on that ship .	Now don't get jittery , Luke . There are a lot of command ships . Keep your distance though , Chewie , but don't look like you 're trying to keep your distance .
I don't know . Fly casual .	I 'm endangering the mission . I shouldn't have come .
I 'm endangering the mission . I shouldn't have come .	It 's your imagination , kid . Come on . Let 's keep a little optimism here .
Chewie and I will take care of this . You stay here .	Quietly , there might be more of them out there .
I thought she was with you .	We got separated .
Take the squad ahead . We 'll meet at the shield generator at 0300 .	Come on , Artoo . We 'll need your scanners .
Nice work . Great , Chewie ! Great ! Always thinking with your stomach .	Will you take it easy ? Let 's just figure out a way to get out of this thing . Han , can you reach my lightsaber ?
Will you take it easy ? Let 's just figure out a way to get out of this thing . Han , can you reach my lightsaber ?	Yeah , sure .
Hey !	Han , don't . It 'll be all right .
Somehow , I got the feeling that didn't help us very much .	Threepio , tell them if they don't do as you wish , you 'll become angry and use your magic .
Someone who loves you .	Leia !
Leia !	I gotta get you out of here .
I don't know . All I can see is a lot of blowing sand !	That 's all any of us can see .
Hey , are you awake ?	Yeah , I just got a funny feeling . Like I 'm not gonna see her again .
Now we find out if that code is worth the price we paid .	It 'll work . It 'll work .
Shall we try and go around ?	It 'll take time . This whole party 'll be for nothing if they see us .
What 's going on ?	I don't know .
I .	Ahhh .
I 'm sorry .	Hold me .
The main entrance to the control bunker 's on the far side of that landing platform . This isn't gonna be easy .	Hey , don't worry . Chewie and me got into a lot of places more heavily guarded than this .
Han ! Hurry ! The fleet will be here any moment .	Charges ! Come on , come on !
The code 's changed . We need Artoo !	Here 's the terminal .
I 'm sure Luke wasn't on that thing when it blew .	He wasn't . I can feel it .
He wasn't . I can feel it .	You love him , don't you ?
Yes .	All right . I understand . Fine . When he comes back , I won't get in the way .
Han ! Chewie ?	Lando !
Lando , grab it !	Lower it !
Lower it !	I 'm trying !
Chewie ! Chewie , give me the gun . Don't move , Lando .	No , wait ! I thought you were blind !
No , wait ! I thought you were blind !	It 's all right . Trust me . Don't move .
It 's all right . Trust me . Don't move .	All right ! A little higher ! Just a little higher !
Guess I owe you some thanks , too , Lando .	Figured if I left you frozen like that you 'd just give me bad luck the rest of my life , so I might as well get you unfrozen sooner or later .
Well , look at you , a general , huh ?	Oh , well , someone must have told them about my little maneuver at the battle of Taanab .
Look . I want you to take her . I mean it . Take her . You need all the help you can get . She 's the fastest ship in the fleet .	All right , old buddy . You know , I know what she means to you . I 'll take good care of her . She-she won't get a scratch . All right ?
Good luck .	You , too .
Oh , dear . His High Exaltedness , the great Jabba the Hutt , has decreed that you are to be terminated immediately .	Good , I hate long waits .
Good , I hate long waits .	You will therefore be taken to the Dune Sea and cast into the pit of Carkoon , the nesting place of the all-powerful Sarlacc .
In his belly , you will find a new definition of pain and suffering , as you are slowly digested over a thousand years .	On second thought , let 's pass on that , huh ?
Here we go again .	All right , hang on .
What are you telling them ?	Hello , I think . I could be mistaken . They 're using a very primitive dialect . But I do believe they think I am some sort of god .
Well , why don't you use your divine influence and get us out of this ?	I beg your pardon , General Solo , but that just wouldn't be proper .
I beg your pardon , General Solo , but that just wouldn't be proper .	Proper ?!
Proper ?!	It 's against my programming to impersonate a deity .
What did he say ?	I 'm rather embarrassed , General Solo , but it appears you are to be the main course at a banquet in my honor .
We 're coming !	Come on ! Come on !
Come on ! Come on !	Oh , Artoo , hurry !
My goodness ! Artoo , why did you have to be so brave ?	Well , I suppose I could hotwire this thing .
Oh , Princess Leia , are you all right ?	Let 's see .
Lord Vader , this is an unexpected pleasure . We 're honored by your presence .	You may dispense with the pleasantries , Commander . I 'm here to put you back on schedule .
I assure you , Lord Vader , my men are working as fast as they can .	Perhaps I can find new ways to motivate them .
Perhaps I can find new ways to motivate them .	I tell you , this station will be operational as planned .
I tell you , this station will be operational as planned .	The Emperor does not share your optimistic appraisal of the situation .
The Emperor does not share your optimistic appraisal of the situation .	But he asks the impossible . I need more men .
But he asks the impossible . I need more men .	Then perhaps you can tell him when he arrives .
That is correct , Commander . And he is most displeased with your apparent lack of progress .	We shall double our efforts .
We shall double our efforts .	I hope so , Commander , for your sake . The Emperor is not as forgiving as I am .
All wings report in .	Red Leader standing by .
Good shot , Red Two .	Now . come on , Han , old buddy . Don't let me down .
I 'm going in .	Here goes nothing .
Now lock onto the strongest power source . It should be the power generator .	Form up . And stay alert . We could run out of space real fast .
There it is !	All right , Wedge . Go for the power regulator on the north tower .
All right , Wedge . Go for the power regulator on the north tower .	Copy , Gold Leader . I 'm already on my way out .
Ugh !	Ohhh , I can't bear to watch .
Oh !	Your Royal Highness .
What 's he saying ?	He says there 's a secret entrance on the other side of the ridge .
Oh ! Oh , my . Uh , Princess Leia !	Quiet .
Quiet .	I 'm afraid our furry companion has gone and done something rather rash .
I 'm afraid our furry companion has gone and done something rather rash .	Oh , no .
Over there ! Two more of them !	I see them . Wait , Leia !
Leia . do you remember your mother ? Your real mother ?	Just a little bit . She died when I was very young .
Just a little bit . She died when I was very young .	What do you remember ?
What do you remember ?	Just . images , really . Feelings .
Just . images , really . Feelings .	Tell me .
Tell me .	She was very beautiful . Kind , but . sad . Why are you asking me all this ?
I have no memory of my mother . I never knew her .	Luke , tell me . What 's troubling you ?
Luke , tell me . What 's troubling you ?	Vader is here . now , on this moon .
He 's my father .	Your father ?
Your father ?	There 's more . It won't be easy for you to hear it , but you must . If I don't make it back , you 're the only hope for the Alliance .
Luke , don't talk that way . You have a power I-I don't understand and could never have .	You 're wrong , Leia . You have that power too . In time you 'll learn to use it as I have . The Force is strong in my family . My father has it . I have it.and.my sister has it .
Yes . It 's you Leia .	I know . Somehow . I 've always known .
I know . Somehow . I 've always known .	Then you know why I have to face him .
Then you know why I have to face him .	No ! Luke , run away , far away . If he can feel your presence , then leave this place . I wish I could go with you .
No ! Luke , run away , far away . If he can feel your presence , then leave this place . I wish I could go with you .	No , you don't . You 've always been strong .
No , you don't . You 've always been strong .	But , why must you confront him ?
