But , why must you confront him ?	Because . there is good in him . I 've felt it . He won't turn me over to the Emperor . I can save him . I can turn him back to the good side . I have to try .
The Emperor has been expecting you .	I know , father .
I know , father .	So , you have accepted the truth .
Come with me .	Obi-Wan once thought as you do .
You don't know the power of the dark side . I must obey my master .	I will not turn . and you 'll be forced to kill me .
I will not turn . and you 'll be forced to kill me .	If that is your destiny .
If that is your destiny .	Search your feelings , father . You can't do this . I feel the conflict within you . Let go of your hate .
Search your feelings , father . You can't do this . I feel the conflict within you . Let go of your hate .	It is too late for me , son . The Emperor will show you the true nature of the Force . He is your master now .
Obi-Wan has taught you well .	I will not fight you , father .
Your thoughts betray you , father . I feel the good in you . the conflict .	There is no conflict .
There is no conflict .	You couldn't bring yourself to kill me before , and I don't believe you 'll destroy me now .
You couldn't bring yourself to kill me before , and I don't believe you 'll destroy me now .	You underestimate the power of the dark side . If you will not fight , then you will meet your destiny .
You cannot hide forever , Luke .	I will not fight you .
I will not fight you .	Give yourself to the dark side . It is the only way you can save your friends . Yes , your thoughts betray you . Your feelings for them are strong . Especially for .
Sister ! So . you have a twin sister . Your feelings have now betrayed her , too . Obi-Wan was wise to hide her from me . Now his failure is complete . If you will not turn to the dark side , then perhaps she will .	Never-r-r !
Master Yoda , you can't die .	Strong am I with the Force . but not that strong ! Twilight is upon me and soon night must fall . That is the way of things . the way of the Force .
Strong am I with the Force . but not that strong ! Twilight is upon me and soon night must fall . That is the way of things . the way of the Force .	But I need your help . I 've come back to complete the training .
But I need your help . I 've come back to complete the training .	No more training do you require . Already know you that which you need .
Yoda , I must know .	Your father he is .
Told you , did he ?	Yes .
Unexpected this is , and unfortunate .	Unfortunate that I know the truth ?
Well , I 'm sorry .	Remember , a Jedi 's strength flows from the Force . But beware . Anger , fear , aggression . The dark side are they . Once you start down the dark path , forever will it dominate your destiny .
Ah , good . New acquisitions . You are a protocol droid , are you not ?	I am See-Threepio , human-cy .
I am See-Threepio , human-cy .	Yes or no will do .
Yes or no will do .	Oh . Well , yes .
Oh . Well , yes .	How many languages do you speak ?
How many languages do you speak ?	I am fluent in over six million forms of communication , and can readily .
I am fluent in over six million forms of communication , and can readily .	Splendid ! We have been without an interpreter since our master got angry with our last protocol droid and disintegrated him .
Splendid ! We have been without an interpreter since our master got angry with our last protocol droid and disintegrated him .	Disintegrated ?
